{
  "title": "AppKit",
  "icon": "box",
  "root": true,
  "pages": [
    "overview",
    "changelog",
    "---Get Started---",
    "...get-started",
    "---How to---",
    "...howto",
    "---Concepts---",
    "...concepts",
    "---Reference---",
    "...reference",
    "faq-troubleshooting"
  ]
}
